<?xml version="1.0" encoding="UTF-8"?>

<testcase xmlns="testcase"
          xmlns:xsi="http://www.w3.org/2001/XMLSchema-instance"
          xsi:schemaLocation='testcase ../xsd/testcase.xsd'>
    <inkassoFall id="ik1" forderungsjahr="2015" forderungsart="BST_NP" zpvnr="1">
        <faktura id="fk11" valuta="2015-01-01" belegart="schlussabrechnung">
            <position>
                <kategorie type="einkommenssteuer"/>
                <institution art="kanton"/>
                <betrag>100</betrag>
            </position>
            <position>
                <kategorie type="vermoegenssteuer"/>
                <institution art="kanton" nummer="1"/>
                <betrag>200</betrag>
            </position>
        </faktura>
    </inkassoFall>
    <inkassoFall id="ik2" forderungsjahr="2016" forderungsart="BST_NP" zpvnr="1">
        <faktura id="fk21" valuta="2016-01-01" belegart="provisorische_abrechnung">
            <position>
                <kategorie type="einkommenssteuer"/>
                <institution art="gemeinde" nummer="1234"/>
                <betrag>300</betrag>
            </position>
        </faktura>
        <faktura  id="fk22" valuta="2017-12-01" belegart="schlussabrechnung">
            <position>
                <kategorie type="einkommenssteuer"/>
                <institution art="gemeinde" nummer="1234"/>
                <betrag>1000</betrag>
            </position>
        </faktura>
    </inkassoFall>
    <when>
        <esr art="1" faktura="fk11" betrag="900"/>
    </when>
    <then>
        <kontoauszug valuta="2017-01-01" belegart="zahlung" konto="V_BST">
            <position>
                <kategorie type="einkommenssteuer"/>
                <institution art="kanton"/>
                <betrag>800</betrag>
            </position>
        </kontoauszug>
    </then>
</testcase>
