<?xml version="1.0" encoding="UTF-8"?>

<testcase xmlns="testcase"
          xmlns:xsi="http://www.w3.org/2001/XMLSchema-instance"
          xsi:schemaLocation='testcase.xsd ../xsd/testcase.xsd'>
    <inkassoFall id="ik1" forderungjahr="2015" forderungsart="BST_NP" zpvnr="1">
        <faktura id="fk11" valuta="2015-01-01">
            <position>
                <kategorie type="" subtype=""/>
                <institution art="bund" nummer="1"/>
                <betrag>100</betrag>
            </position>
            <position>
                <kategorie type="" subtype=""/>
                <institution art="gemeinede" nummer="20"/>
                <betrag>200</betrag>
            </position>
        </faktura>
    </inkassoFall>
    <inkassoFall id="ik2" forderungjahr="2016" forderungsart="BST_NP" zpvnr="1">
        <faktura id="fk21" valuta="2016-01-01">
            <position>
                <kategorie></kategorie>
                <institution></institution>
                <betrag>300</betrag>
            </position>
        </faktura>
        <faktura  id="fk22" valuta="2017-12-01">
        <position>
            <kategorie type="BUND" subtype=""/>
            <institution art="BUND"/>
            <betrag>1000</betrag>
        </position>
        </faktura>
    </inkassoFall>
    <when>
        <esr art="1" faktura="fk11"/>
        <betrag>900</betrag>
    </when>
    <then></then>
</testcase>
