<?xml version="1.0" encoding="UTF-8"?>

<testcase xmlns="testcase"
          xmlns:xsi="http://www.w3.org/2001/XMLSchema-instance"
          xsi:schemaLocation='testcase ./xsd/testCase.xsd'>
    <inkassoFall id="ik1" forderungjahr="2015" forderungsart="BST_NP" zpvnr="1">
        <faktura id="fk11" valuta="2015">
            <position>
                <kategorie type="" subtype=""/>
                <institution art="bund" nummer="1"/>
                <betrag>100</betrag>
            </position>
            <position>
                <kategorie type="" subtype=""/>
                <institution art="gemeinede" nummer="20"/>
                <betrag>200</betrag>
            </position>
        </faktura>
    </inkassoFall>
    <inkassoFall id="ik2" forderungjahr="2016" forderungsart="BST_NP" zpvnr="1">
        <faktura id="fk21" valuta="1.10.2016">
            <position>
                <kategorie></kategorie>
                <institution></institution>
                <betrag>300</betrag>
            </position>
        </faktura>
    </inkassoFall>
    <when>
        <esr art="1" faktura="fk1" />
    </when>
    <then></then>
</testcase>
